Title 电影,Director 导演,Rank 排名,Year 年份,Region 地区,豆瓣电影,豆瓣打分,豆瓣信息,IMDb电影,IMDb打分
L' eclisse,Directed by Michelangelo Antonioni,🎉196,1962,"Italy, France",[蚀 L'eclisse](https://movie.douban.com/subject/1293105/),🌟8.4,"导演: 米开朗基罗·安东尼奥尼, 主演: 阿兰·德龙 / 莫尼卡·维蒂 / 弗朗西斯科·拉瓦尔, 类型: 剧情 / 爱情, 制片国家/地区: 意大利/法国, 年份: 1962",[L'Eclisse](https://www.imdb.com/title/tt0056736/),🌟7.7
Double Indemnity,Directed by Billy Wilder,🎉196,1944,USA,[双重赔偿 Double Indemnity](https://movie.douban.com/subject/1293226/),🌟8.5,"导演: 比利·怀尔德, 主演: 弗莱德·麦克莫瑞 / 芭芭拉·斯坦威克 / 爱德华·罗宾逊, 类型: 剧情 / 犯罪 / 悬疑 / 惊悚 / 黑色电影, 制片国家/地区: 美国, 年份: 1944",[Double Indemnity](https://www.imdb.com/title/tt0036775/),🌟8.3
Dr. Strangelove or: How I Learned to Stop Worrying and Love the Bomb,Directed by Stanley Kubrick,🎉196,1963,"United Kingdom, USA",[奇爱博士 Dr. Strangelove or: How I Learned to Stop Worrying and Love the Bomb](https://movie.douban.com/subject/1322848/),🌟8.9,"导演: 斯坦利·库布里克, 主演: 彼得·塞勒斯 / 乔治·C·斯科特 / 斯特林·海登, 类型: 剧情 / 喜剧 / 战争, 制片国家/地区: 美国/英国, 年份: 1964",[Dr. Strangelove or: How I Learned to Stop Worrying and Love the Bomb](https://www.imdb.com/title/tt0057012/),🌟8.4
One Way or Another,Directed by Sara Gómez,🎉196,1977,Cuba,[这样或那样 De cierta manera](https://movie.douban.com/subject/1902590/),🌟7.8,"导演: 萨拉·戈麦斯, 主演: 马里奥·巴尔马塞达 / Yolanda Cuéllar / Mario Limonta, 类型: 剧情, 制片国家/地区: 古巴, 年份: 1978",[One Way or Another](https://www.imdb.com/title/tt0075915/),🌟7.1
Nosferatu,Directed by F.W. Murnau,🎉196,1922,Germany,"[诺斯费拉图 Nosferatu, eine Symphonie des Grauens](https://movie.douban.com/subject/1296791/)",🌟8.2,"导演: F·W·茂瑙, 主演: 马科斯·夏瑞克 / 古斯塔·冯·瓦根海姆 / 格里塔·斯楚瑞德, 类型: 奇幻 / 恐怖, 制片国家/地区: 德国, 年份: 1922",[Nosferatu](https://www.imdb.com/title/tt0013442/),🌟7.9
Paisan,Directed by Roberto Rossellini,🎉196,1946,Italy,[战火 Paisà](https://movie.douban.com/subject/1299257/),🌟8.2,"导演: 罗伯托·罗西里尼, 主演: 卡米拉萨齐奥 / 罗伯托范隆 / Benjamin Emanuel, 类型: 剧情 / 战争, 制片国家/地区: 意大利, 年份: 1946",[Paisan](https://www.imdb.com/title/tt0038823/),🌟7.6
Zama,Directed by Lucrecia Martel,🎉196,2017,"Argentina, Brazil, Spain, France, Mexico, Netherlands, Monaco, Portugal, USA, Lebanon, United Kingdom, Dominican Republic",[扎马 Zama](https://movie.douban.com/subject/24719134/),🌟7.2,"导演: 卢奎西亚·马特尔, 主演: 丹尼尔·希梅内斯·卡乔 / 洛拉·杜埃尼亚斯 / 马修斯·纳克加勒, 类型: 剧情, 制片国家/地区: 阿根廷/西班牙/法国/荷兰/美国/巴西/墨西哥/葡萄牙/黎巴嫩/瑞士, 年份: 2017",[Zama](https://www.imdb.com/title/tt3409848/),🌟6.7
Mad Max: Fury Road,Directed by George Miller,🎉196,2015,"USA, Australia",[疯狂的麦克斯4：狂暴之路 Mad Max: Fury Road](https://movie.douban.com/subject/3592854/),🌟8.7,"导演: 乔治·米勒, 主演: 汤姆·哈迪 / 查理兹·塞隆 / 尼古拉斯·霍尔特, 类型: 动作 / 科幻 / 冒险, 制片国家/地区: 澳大利亚/美国, 年份: 2015",[Mad Max: Fury Road](https://www.imdb.com/title/tt1392190/),🌟8.1
The Tree of Life,Directed by Terrence Malick,🎉196,2010,USA,[生命之树 The Tree of Life](https://movie.douban.com/subject/2336735/),🌟7.1,"导演: 泰伦斯·马力克, 主演: 布拉德·皮特 / 西恩·潘 / 杰西卡·查斯坦, 类型: 剧情 / 奇幻 / 家庭, 制片国家/地区: 美国, 年份: 2011",[The Tree of Life](https://www.imdb.com/title/tt0478304/),🌟6.8
Uncle Boonmee Who Can Recall His Past Lives,Directed by Apichatpong Weerasethakul,🎉196,2010,"Thailand, United Kingdom, France, Germany, Spain, Netherlands",[能召回前世的布米叔叔 ลุงบุญมีระลึกชาติ](https://movie.douban.com/subject/4280102/),🌟7.4,"导演: 阿彼察邦·韦拉斯哈古, 主演: 萨那帕卡·塞塞玛 / 金吉拉·潘帕斯 / 萨卡达·卡温巴迪, 类型: 剧情 / 奇幻, 制片国家/地区: 泰国/英国/法国/德国/西班牙/荷兰, 年份: 2010",[Uncle Boonmee Who Can Recall His Past Lives](https://www.imdb.com/title/tt1588895/),🌟6.7
The Headless Woman,Directed by Lucrecia Martel,🎉196,2008,"Argentina, Spain, France, Italy",[无头的女人 La mujer sin cabeza](https://movie.douban.com/subject/3047620/),🌟7.2,"导演: 卢奎西亚·马特尔, 主演: 玛莉亚·奥内托 / Claudia Cantero / 伊娜丝·艾芙隆, 类型: 剧情 / 悬疑 / 惊悚, 制片国家/地区: 阿根廷/法国/意大利/西班牙, 年份: 2008",[The Headless Woman](https://www.imdb.com/title/tt1221141/),🌟6.6
Paris Is Burning,Directed by Jennie Livingston,🎉196,1990,"USA, United Kingdom",[巴黎在燃烧 Paris Is Burning](https://movie.douban.com/subject/1299344/),🌟9.0,"导演: 詹尼•利文斯通, 主演: Brooke Xtravaganza / André Christian / Dorian Corey, 类型: 纪录片 / 同性, 制片国家/地区: 美国, 年份: 1990",[Paris Is Burning](https://www.imdb.com/title/tt0100332/),🌟8.2
By the Bluest of Seas,Directed by Boris Barnet,🎉211,1935,USSR,[浮于碧海 У самого синего моря](https://movie.douban.com/subject/2369090/),🌟6.9,"导演: 鲍里斯·巴尔涅特 / S. Mardanin, 主演: Alexei Dolinin / 谢尔盖·科马罗夫 / 尼古拉·克留奇科夫, 类型: 剧情, 制片国家/地区: 苏联, 年份: 1936",[By the Bluest of Seas](https://www.imdb.com/title/tt0028436/),🌟6.9
Duck Soup,Directed by Leo McCarey,🎉211,1933,USA,[鸭羹 Duck Soup](https://movie.douban.com/subject/1298113/),🌟7.2,"导演: 莱奥·麦卡雷, 主演: 格劳乔·马克斯 / 哈勃·马克斯 / 奇科·马克斯, 类型: 喜剧 / 歌舞, 制片国家/地区: 美国, 年份: 1933",[Duck Soup](https://www.imdb.com/title/tt0023969/),🌟7.8
All about Eve,Directed by Joseph L. Mankiewicz,🎉211,1950,USA,[彗星美人 All About Eve](https://movie.douban.com/subject/1401385/),🌟8.7,"导演: 约瑟夫·L·曼凯维奇, 主演: 贝蒂·戴维斯 / 安妮·巴克斯特 / 乔治·桑德斯, 类型: 剧情, 制片国家/地区: 美国, 年份: 1950",[All About Eve](https://www.imdb.com/title/tt0042192/),🌟8.2
Brief Encounter,Directed by David Lean,🎉211,1945,United Kingdom,[相见恨晚 Brief Encounter](https://movie.douban.com/subject/1294364/),🌟8.0,"导演: 大卫·里恩, 主演: 西莉亚·约翰逊 / 特瑞沃·霍华德 / 斯坦利·霍洛威, 类型: 爱情 / 剧情, 制片国家/地区: 英国, 年份: 1945",[Brief Encounter](https://www.imdb.com/title/tt0037558/),🌟8
Suspiria,Directed by Dario Argento,🎉211,1977,Italy,[阴风阵阵 Suspiria](https://movie.douban.com/subject/1296332/),🌟7.6,"导演: 达里奥·阿基多, 主演: 杰西卡·哈珀 / 斯蒂芬妮娅·卡西尼 / 弗拉维奥·布奇, 类型: 恐怖, 制片国家/地区: 意大利, 年份: 1977",[Suspiria](https://www.imdb.com/title/tt0076786/),🌟7.3
In a Lonely Place,Directed by Nicholas Ray,🎉211,1950,USA,[兰闺艳血 In a Lonely Place](https://movie.douban.com/subject/1302923/),🌟7.9,"导演: 尼古拉斯·雷, 主演: 亨弗莱·鲍嘉 / 格洛丽亚·格雷厄姆 / 弗兰克·洛夫乔伊, 类型: 剧情 / 黑色电影 / 悬疑 / 爱情 / 惊悚, 制片国家/地区: 美国, 年份: 1950",[In a Lonely Place](https://www.imdb.com/title/tt0042593/),🌟7.9
The Deer Hunter,Directed by Michael Cimino,🎉211,1978,USA,[猎鹿人 The Deer Hunter](https://movie.douban.com/subject/1292403/),🌟8.3,"导演: 迈克尔·西米诺, 主演: 罗伯特·德尼罗 / 约翰·凯泽尔 / 约翰·萨维奇, 类型: 剧情 / 战争, 制片国家/地区: 美国, 年份: 1978",[The Deer Hunter](https://www.imdb.com/title/tt0077416/),🌟8.1
Army of Shadows,Directed by Jean-Pierre Melville,🎉211,1969,"France, Italy",[影子部队 L'armée des ombres](https://movie.douban.com/subject/1466419/),🌟8.6,"导演: 让-皮埃尔·梅尔维尔, 主演: 利诺·文图拉 / 保罗·默里斯 / 让-皮埃尔·卡塞尔, 类型: 剧情 / 战争, 制片国家/地区: 法国/意大利, 年份: 1969",[Army of Shadows](https://www.imdb.com/title/tt0064040/),🌟8.1
Melancholia,Directed by Lars von Trier,🎉211,2011,"Denmark, Sweden, France, Germany, Italy",[忧郁症 Melancholia](https://movie.douban.com/subject/4086853/),🌟7.1,"导演: 拉斯·冯·提尔, 主演: 克斯汀·邓斯特 / 夏洛特·甘斯布 / 基弗·萨瑟兰, 类型: 剧情 / 科幻 / 惊悚, 制片国家/地区: 丹麦/瑞典/法国/德国, 年份: 2011",[Melancholia](https://www.imdb.com/title/tt1527186/),🌟7.1
Twenty Years Later,Directed by Eduardo Coutinho,🎉211,1984,Brazil,[二十年后 Cabra Marcado Para Morrer](https://movie.douban.com/subject/1925768/),🌟7.6,"导演: 爱德华多·库蒂尼奥, 主演: 爱德华多·库蒂尼奥 / Tite de Lemos / Ferreira Gullar, 类型: 纪录片, 制片国家/地区: 巴西, 年份: 1984",[Twenty Years Later](https://www.imdb.com/title/tt0134402/),🌟8.3
Twin Peaks: Fire Walk with Me,Directed by David Lynch,🎉211,1992,USA,[双峰：与火同行 Twin Peaks: Fire Walk with Me](https://movie.douban.com/subject/1303472/),🌟7.9,"导演: 大卫·林奇, 主演: 雪莉·李 / 雷·怀斯 / 梅晨·阿米克, 类型: 剧情 / 悬疑 / 惊悚 / 恐怖, 制片国家/地区: 法国/美国, 年份: 1992",[Twin Peaks: Fire Walk with Me](https://www.imdb.com/title/tt0105665/),🌟7.3
Pink Flamingos,Directed by John Waters,🎉211,1972,USA, , , ,[Pink Flamingos](https://www.imdb.com/title/tt0069089/),🌟6
Raiders of the Lost Ark,Directed by Steven Spielberg,🎉211,1981,USA,[夺宝奇兵 Raiders of the Lost Ark](https://movie.douban.com/subject/1296717/),🌟7.9,"导演: 史蒂文·斯皮尔伯格, 主演: 哈里森·福特 / 凯伦·阿兰 / 保罗·弗里曼, 类型: 动作 / 冒险, 制片国家/地区: 美国, 年份: 1981",[Raiders of the Lost Ark](https://www.imdb.com/title/tt0082971/),🌟8.4
Limite,Directed by Mário Peixoto,🎉211,1931,Brazil,[界限 Limite](https://movie.douban.com/subject/1925767/),🌟7.6,"导演: 马里奥·皮索托, 主演: Iolanda Bernardes / Edgar Brasil / 马里奥·皮索托, 类型: 剧情, 制片国家/地区: 巴西, 年份: 1931",[Limit](https://www.imdb.com/title/tt0022080/),🌟7.1
"Harlan County, USA",Directed by Barbara Kopple,🎉225,1976,USA,"[美国哈兰县 Harlan County, U.S.A.](https://movie.douban.com/subject/1294724/)",🌟8.6,"导演: 芭芭拉·卡颇, 主演: John Corcoran / 约翰·奥莱利 / Tom Williams, 类型: 纪录片, 制片国家/地区: 美国, 年份: 1976",[Harlan County U.S.A.](https://www.imdb.com/title/tt0074605/),🌟8.2
Cries and Whispers,Directed by Ingmar Bergman,🎉225,1972,Sweden,[呼喊与细语 Viskningar och rop](https://movie.douban.com/subject/1296147/),🌟8.6,"导演: 英格玛·伯格曼, 主演: 哈里特·安德森 / 卡莉·西尔万 / 英格丽·图林, 类型: 剧情 / 爱情, 制片国家/地区: 瑞典, 年份: 1972",[Cries & Whispers](https://www.imdb.com/title/tt0069467/),🌟8
Star Wars,Directed by George Lucas,🎉225,1977,USA,[星球大战 Star Wars](https://movie.douban.com/subject/1293838/),🌟8.5,"导演: 乔治·卢卡斯, 主演: 哈里森·福特 / 马克·哈米尔 / 凯丽·费雪, 类型: 动作 / 科幻 / 冒险, 制片国家/地区: 美国, 年份: 1977",[Star Wars: Episode IV - A New Hope](https://www.imdb.com/title/tt0076759/),🌟8.6
Intolerance,Directed by D.W. Griffith,🎉225,1916,USA,[党同伐异 Intolerance: Love's Struggle Throughout the Ages](https://movie.douban.com/subject/1295287/),🌟8.7,"导演: 大卫·格里菲斯, 主演: 丽莲·吉许 / 梅·马什 / 罗伯特·哈伦, 类型: 剧情 / 历史 / 爱情, 制片国家/地区: 美国, 年份: 1916",[Intolerance](https://www.imdb.com/title/tt0006864/),🌟7.7
The Hour of the Furnaces,Directed by Fernando Solanas,🎉225,1968,Argentina,[燃火的时刻 Hora de los hornos](https://movie.douban.com/subject/2245725/),🌟8.7,"导演: 费尔南多·索拉纳斯 / 奥克塔维奥·赫蒂诺, 主演: María de la Paz / Fernando E. Solanas / Edgardo Suárez, 类型: 纪录片 / 历史 / 战争, 制片国家/地区: 阿根廷, 年份: 1970",[The Hour of the Furnaces](https://www.imdb.com/title/tt0063084/),🌟7.7
Europa '51,Directed by Roberto Rossellini,🎉225,1952,Italy,[一九五一年的欧洲 Europa '51](https://movie.douban.com/subject/1293321/),🌟8.0,"导演: 罗伯托·罗西里尼, 主演: 英格丽·褒曼 / 亚历山大·诺克斯 / 埃托雷贾尼尼, 类型: 剧情, 制片国家/地区: 意大利, 年份: 1952",[Europe '51](https://www.imdb.com/title/tt0043511/),🌟7.4
Napoléon,Directed by Abel Gance,🎉225,1927,France,[拿破仑 Napoléon](https://movie.douban.com/subject/1401756/),🌟8.6,"导演: 阿贝尔·冈斯, 主演: 阿尔伯特·迪厄多内 / Alexandre Koubitzky / 安托南·阿尔托, 类型: 传记 / 剧情 / 历史 / 战争, 制片国家/地区: 法国, 年份: 1927",[Napoleon](https://www.imdb.com/title/tt0018192/),🌟8.2
The Crowd,Directed by King Vidor,🎉225,1928,USA,[群众 The Crowd](https://movie.douban.com/subject/1293273/),🌟8.3,"导演: 金·维多, 主演: 埃莉诺·博德曼 / 詹姆斯·默里 / 伯特·罗奇, 类型: 剧情 / 爱情, 制片国家/地区: 美国, 年份: 1928",[The Crowd](https://www.imdb.com/title/tt0018806/),🌟8.1
A Touch of Zen,Directed by King Hu,🎉225,1969,Taiwan,[侠女 俠女](https://movie.douban.com/subject/1306490/),🌟8.6,"导演: 胡金铨, 主演: 徐枫 / 石隽 / 白鹰, 类型: 剧情 / 动作 / 武侠 / 古装, 制片国家/地区: 中国台湾/中国香港, 年份: 1970",[A Touch of Zen](https://www.imdb.com/title/tt0064451/),🌟7.5
"Je, tu, il, elle",Directed by Chantal Akerman,🎉225,1974,Belgium,"[我你他她 Je, tu, il, elle](https://movie.douban.com/subject/1429055/)",🌟7.8,"导演: 香特尔·阿克曼, 主演: 香特尔·阿克曼 / 尼尔斯·阿贺斯图普 / Claire Wauthion, 类型: 剧情, 制片国家/地区: 比利时/法国, 年份: 1974",[Je Tu Il Elle](https://www.imdb.com/title/tt0071690/),🌟6.7
Petite maman,Directed by Céline Sciamma,🎉225,2021,France,[小妈妈 Petite maman](https://movie.douban.com/subject/35225859/),🌟8.0,"导演: 瑟琳·席安玛, 主演: 约瑟芬·桑兹 / 加布里埃尔·桑兹 / 尼娜·梅尔瑞斯, 类型: 剧情 / 奇幻, 制片国家/地区: 法国, 年份: 2021",[Petite Maman](https://www.imdb.com/title/tt13204490/),🌟7.4
"As I Was Moving Ahead, Occasionally I Saw Brief Glimpses of Beauty",Directed by Jonas Mekas,🎉225,2000,USA,[当我往前走之时偶尔会瞥到一缕美丽之景 As I Was Moving Ahead Occasionally I Saw Brief Glimpses of Beauty](https://movie.douban.com/subject/4117025/),🌟8.7,"导演: 乔纳斯·梅卡斯, 主演: 乔纳斯·梅卡斯 / 阿道法斯·梅卡斯 / Oona Mekas, 类型: 纪录片 / 传记, 制片国家/地区: 美国, 年份: 2000",[As I Was Moving Ahead Occasionally I Saw Brief Glimpses of Beauty](https://www.imdb.com/title/tt0262240/),🌟8.2
Flowers of Shanghai,Directed by Hou Hsiao-Hsien,🎉225,1998,"Taiwan, Japan",[海上花](https://movie.douban.com/subject/1303451/),🌟8.2,"导演: 侯孝贤, 主演: 梁朝伟 / 羽田美智子 / 刘嘉玲, 类型: 剧情, 制片国家/地区: 中国台湾/日本, 年份: 1998",[Flowers of Shanghai](https://www.imdb.com/title/tt0156587/),🌟7.3
Happy Together,Directed by Wong Kar Wai,🎉225,1997,Hong Kong,[春光乍泄 春光乍洩](https://movie.douban.com/subject/1292679/),🌟9.0,"导演: 王家卫, 主演: 张国荣 / 梁朝伟 / 张震, 类型: 剧情 / 爱情 / 同性, 制片国家/地区: 中国香港/日本/韩国, 年份: 1997",[Happy Together](https://www.imdb.com/title/tt0118845/),🌟7.7
Crash,Directed by David Cronenberg,🎉225,1996,Canada,[欲望号快车 Crash](https://movie.douban.com/subject/1292682/),🌟7.0,"导演: 大卫·柯南伯格, 主演: 詹姆斯·斯派德 / 霍利·亨特 / 伊莱亚斯·科泰斯, 类型: 剧情, 制片国家/地区: 加拿大/美国/英国, 年份: 1996",[Crash](https://www.imdb.com/title/tt0115964/),🌟6.4
Blue,Directed by Derek Jarman,🎉225,1993,"United Kingdom, Japan",[蓝 Blue](https://movie.douban.com/subject/1417428/),🌟8.6,"导演: 德里克·贾曼, 主演: 约翰·昆汀 / 尼吉尔·特瑞 / 德里克·贾曼, 类型: 剧情 / 传记 / 同性, 制片国家/地区: 英国/日本, 年份: 1993",[Blue](https://www.imdb.com/title/tt0106438/),🌟7.3
Grave of the Fireflies,Directed by Isao Takahata,🎉225,1988,Japan,[萤火虫之墓 火垂るの墓](https://movie.douban.com/subject/1293318/),🌟8.7,"导演: 高畑勋, 主演: 辰己努 / 白石绫乃 / 志乃原良子, 类型: 动画 / 剧情 / 战争, 制片国家/地区: 日本, 年份: 1988",[Grave of the Fireflies](https://www.imdb.com/title/tt0095327/),🌟8.5
The Green Ray,Directed by Eric Rohmer,🎉225,1986,France,[绿光 Le rayon vert](https://movie.douban.com/subject/1294039/),🌟8.1,"导演: 埃里克·侯麦, 主演: 艾琳.申科布莱恩 / 玛丽·里维埃 / 碧翠丝·罗曼德, 类型: 剧情 / 爱情, 制片国家/地区: 法国, 年份: 1986",[The Green Ray](https://www.imdb.com/title/tt0091830/),🌟7.6
Born in Flames,Directed by Lizzie Borden,🎉243,1983, ,[硝烟中的玫瑰 Born in Flames](https://movie.douban.com/subject/1966826/),🌟7.4,"导演: 莉兹·波登, 主演: Honey / Adele Bertei / Jean Satterfield, 类型: 喜剧 / 剧情 / 奇幻 / 科幻, 制片国家/地区: 美国, 年份: 1983",[Born in Flames](https://www.imdb.com/title/tt0085267/),🌟6.5
Pandora's Box,Directed by G.W. Pabst,🎉243,1928,Germany,[潘多拉的魔盒 Die Büchse der Pandora](https://movie.douban.com/subject/1401368/),🌟8.2,"导演: G·W·帕布斯特, 主演: 露易丝·布鲁克斯 / 弗里茨·科特讷 / 弗朗西斯·莱德雷尔, 类型: 犯罪 / 剧情 / 爱情, 制片国家/地区: 德国, 年份: 1929",[Pandora's Box](https://www.imdb.com/title/tt0018737/),🌟7.8
Sullivan's Travels,Directed by Preston Sturges,🎉243,1941,USA,[苏利文的旅行 Sullivan's Travels](https://movie.douban.com/subject/1303416/),🌟7.6,"导演: 普莱斯顿·斯特奇斯, 主演: 乔尔·麦克雷 / 维罗妮卡·莱克 / 罗伯特·沃里克, 类型: 冒险 / 喜剧 / 剧情 / 爱情, 制片国家/地区: 美国, 年份: 1941",[Sullivan's Travels](https://www.imdb.com/title/tt0034240/),🌟7.9
Annie Hall,Directed by Woody Allen,🎉243,1977,USA,[安妮·霍尔 Annie Hall](https://movie.douban.com/subject/1296987/),🌟8.6,"导演: 伍迪·艾伦, 主演: 伍迪·艾伦 / 黛安·基顿 / 托尼·罗伯茨, 类型: 喜剧 / 剧情 / 爱情, 制片国家/地区: 美国, 年份: 1977",[Annie Hall](https://www.imdb.com/title/tt0075686/),🌟8
Earth,Directed by Alexander Dovzhenko,🎉243,1930,"USSR, Ukraine",[大地 Земля](https://movie.douban.com/subject/1474748/),🌟7.9,"导演: 亚历山大·杜辅仁科, 主演: Stepan Shkurat / Semyon Svashenko, 类型: 剧情, 制片国家/地区: 苏联, 年份: 1930",[Earth](https://www.imdb.com/title/tt0021571/),🌟7.2
My Darling Clementine,Directed by John Ford,🎉243,1946,USA,[侠骨柔情 My Darling Clementine](https://movie.douban.com/subject/1299733/),🌟7.9,"导演: 约翰·福特, 主演: 亨利·方达 / 琳达·达内尔 / 维克多·迈彻, 类型: 剧情 / 西部, 制片国家/地区: 美国, 年份: 1946",[My Darling Clementine](https://www.imdb.com/title/tt0038762/),🌟7.7
Mouchette,Directed by Robert Bresson,🎉243,1966,France,[穆谢特 Mouchette](https://movie.douban.com/subject/1302413/),🌟8.5,"导演: 罗伯特·布列松, 主演: 娜丁·诺蒂尔 / Jean-Claude Guilbert / Marie Cardinal, 类型: 剧情, 制片国家/地区: 法国, 年份: 1967",[Mouchette](https://www.imdb.com/title/tt0061996/),🌟7.7
A Clockwork Orange,Directed by Stanley Kubrick,🎉243,1971,"USA, United Kingdom",[发条橙 A Clockwork Orange](https://movie.douban.com/subject/1292233/),🌟8.6,"导演: 斯坦利·库布里克, 主演: 马尔科姆·麦克道威尔 / 帕特里克·马基 / 迈克尔·贝茨, 类型: 犯罪 / 剧情 / 科幻, 制片国家/地区: 英国/美国, 年份: 1971",[A Clockwork Orange](https://www.imdb.com/title/tt0066921/),🌟8.3
A Canterbury Tale,"Directed by Michael Powell, Emeric Pressburger",🎉243,1944,United Kingdom,[夜夜春宵 A Canterbury Tale](https://movie.douban.com/subject/1295943/),🌟7.3,"导演: 迈克尔·鲍威尔 / 埃默里克·普雷斯伯格, 主演: 埃里克·波特曼 / 希拉·西姆 / 丹尼斯·普莱斯, 类型: 喜剧 / 剧情 / 悬疑 / 战争, 制片国家/地区: 英国, 年份: 1944",[A Canterbury Tale](https://www.imdb.com/title/tt0036695/),🌟7.4
Videodrome,Directed by David Cronenberg,🎉243,1983,Canada,[录影带谋杀案 Videodrome](https://movie.douban.com/subject/1295276/),🌟7.4,"导演: 大卫·柯南伯格, 主演: 詹姆斯·伍兹 / 索尼娅·史密茨 / 黛布拉·哈里, 类型: 科幻 / 悬疑 / 惊悚 / 恐怖, 制片国家/地区: 加拿大, 年份: 1983",[Videodrome](https://www.imdb.com/title/tt0086541/),🌟7.2
Possession,Directed by Andrzej Zulawski,🎉243,1981,"France, Federal Republic of Germany",[着魔 Possession](https://movie.douban.com/subject/1297203/),🌟8.0,"导演: 安德烈·祖拉斯基, 主演: 伊莎贝尔·阿佳妮 / 山姆·尼尔 / 玛吉特·卡斯滕森, 类型: 剧情 / 恐怖, 制片国家/地区: 法国/西德, 年份: 1981",[Possession](https://www.imdb.com/title/tt0082933/),🌟7.3
Soleil Ô,Directed by Med Hondo,🎉243,1970,France,[噢，太阳 Soleil Ô](https://movie.douban.com/subject/6030619/),🌟7.8,"导演: 梅德·翁多, 主演: Yane Barry / Bernard Bresson / Greg Germain, 类型: 剧情, 制片国家/地区: 法国/毛里塔尼亚, 年份: 1973","[Oh, Sun](https://www.imdb.com/title/tt0062285/)",🌟7.4
"Distant Voices, Still Lives",Directed by Terence Davies,🎉243,1988,"United Kingdom, Federal Republic of Germany","[远方的声音 Distant Voices, Still Lives](https://movie.douban.com/subject/1305878/)",🌟7.6,"导演: 特伦斯·戴维斯, 主演: Lorraine Ashbourne / 吉恩·波特 / Carl Chase, 类型: 剧情 / 音乐 / 家庭, 制片国家/地区: 英国, 年份: 1988","[Distant Voices, Still Lives](https://www.imdb.com/title/tt0095037/)",🌟7.4
Nostalgia for the Light,Directed by Patricio Guzmán,🎉243,2010,"France, Germany, Chile, Spain, USA",[故乡之光 Nostalgia de la luz](https://movie.douban.com/subject/4307515/),🌟8.4,"导演: 帕特里西奥·古斯曼, 主演: Gaspar Galaz / Lautaro Núñez / Luís Henríquez, 类型: 纪录片 / 剧情, 制片国家/地区: 法国/德国/智利/西班牙, 年份: 2010",[Nostalgia for the Light](https://www.imdb.com/title/tt1556190/),🌟7.6
Syndromes and a Century,Directed by Apichatpong Weerasethakul,🎉243,2006,"Thailand, France, Austria, Netherlands",[恋爱症候群 แสงศตวรรษ](https://movie.douban.com/subject/1857095/),🌟7.9,"导演: 阿彼察邦·韦拉斯哈古, 主演: Nantarat Sawaddikul / Jaruchai Iamaram / Sophon Pukanok, 类型: 剧情, 制片国家/地区: 泰国/法国/奥地利, 年份: 2006",[Syndromes and a Century](https://www.imdb.com/title/tt0477731/),🌟7.3
The Intruder,Directed by Claire Denis,🎉243,2004,"France, Republic of Korea",[入侵者 L'intrus](https://movie.douban.com/subject/1440407/),🌟7.3,"导演: 克莱尔·德尼, 主演: 米歇尔·索博 / 格莱戈尔·科林 / Yekaterina Golubeva, 类型: 剧情, 制片国家/地区: 法国, 年份: 2004",[The Intruder](https://www.imdb.com/title/tt0422491/),🌟6.7
Morvern Callar,Directed by Lynne Ramsay,🎉243,2001,"United Kingdom, Canada",[默文·卡拉 Morvern Callar](https://movie.douban.com/subject/1420042/),🌟7.6,"导演: 琳恩·拉姆塞, 主演: 萨曼莎·莫顿 / 凯瑟琳·麦克德莫特 / Linda McGuire, 类型: 剧情, 制片国家/地区: 英国/加拿大, 年份: 2002",[Morvern Callar](https://www.imdb.com/title/tt0300214/),🌟6.7
In Vanda's Room,Directed by Pedro Costa,🎉243,2000,"Portugal, Germany, Switzerland",[旺妲的房间 No Quarto da Vanda](https://movie.douban.com/subject/1829859/),🌟7.8,"导演: 佩德罗·科斯塔, 主演: Vanda Duarte / Lena Duarte / Zita Duarte, 类型: 剧情 / 纪录片, 制片国家/地区: 葡萄牙/德国/瑞士, 年份: 2000",[In Vanda's Room](https://www.imdb.com/title/tt0139500/),🌟7
Werckmeister Harmonies,Directed by Béla Tarr,🎉243,2000,"Hungary, Germany, France, Switzerland, Italy",[鲸鱼马戏团 Werckmeister harmóniák](https://movie.douban.com/subject/1416898/),🌟8.8,"导演: 贝拉·塔尔 / 阿尼亚斯·赫拉尼茨基, 主演: 拉尔斯·鲁道夫 / 彼得·菲茨 / 汉娜·许古拉, 类型: 剧情 / 悬疑, 制片国家/地区: 匈牙利/意大利/德国/法国, 年份: 2000",[Werckmeister Harmonies](https://www.imdb.com/title/tt0249241/),🌟8
Taste of Cherry,Directed by Abbas Kiarostami,🎉243,1997,Iran,[樱桃的滋味 طعم گیلاس](https://movie.douban.com/subject/1296177/),🌟8.1,"导演: 阿巴斯·基亚罗斯塔米, 主演: 赫玛永·厄沙迪 / 阿卜杜拉曼·巴赫里 / 阿夫欣·呼罗希德·巴赫蒂亚里, 类型: 剧情, 制片国家/地区: 法国/伊朗, 年份: 1997",[Taste of Cherry](https://www.imdb.com/title/tt0120265/),🌟7.7
